,id,title,link,description,box_price_present,box_price_old,box_price_percent,rating,cmt_count
143,310802,Laptop Asus Gaming ROG Zephyrus G14 GA402NJ R7 7735HS/16GB/512GB/6GB RTX3050/144Hz/Túi/Win11 (L4056W),https://www.thegioididong.com/laptop/asus-gaming-rog-zephyrus-g14-ga402nj-r7-l4056w,"Laptop Asus Gaming ROG Zephyrus G14 GA402NJ R7 7735HS (L4056W) với ngôn ngữ thiết kế hiện đại, độc đáo, hiệu năng vượt trội từ card rời RTX 30 series cùng nhiều tính năng tân tiến. Chiếc laptop gaming này sẽ không chỉ mang đến những giờ phút chiến game thoải mái cho anh em mà còn nâng những trải nghiệm sử dụng lên một tầm cao mới.",39.990.000₫ *,42.990.000₫,-6%,,
144,268712,Laptop Dell XPS 17 9710 i7 11800H/16GB/1TB SSD/4GB RTX3050/Touch/Cáp/Office H&S/Win11 (XPS7I7001W1),https://www.thegioididong.com/laptop/dell-xps-17-9710-i7-xps7i7001w1,Laptop Dell XPS 17 9710 (XPS7I7001W1) sẽ không làm người dùng thất vọng khi sở hữu ngoại hình thời thượng cùng những thông số kỹ thuật đẳng cấp. ,39.530.000₫ *,54.730.000₫,-27%,5,1.0
145,289441,Laptop Apple MacBook Air 13 inch M2 2022 8-core CPU/16GB/512GB/10-core GPU (Z15Z0003L),https://www.thegioididong.com/laptop/apple-macbook-air-m2-2022-16gb,"MacBook Air M2 2022 một lần nữa đã khẳng định vị thế hàng đầu của Apple trong phân khúc laptop cao cấp - sang trọng vào giữa năm 2022 khi sở hữu phong cách thiết kế thời thượng, đẳng cấp cùng sức mạnh bộc phá đến từ bộ vi xử lý Apple M2 mạnh mẽ.",39.190.000₫ ,,,4.8,10.0
146,306794,Laptop LG gram 2023 i7 1360P/16GB/512GB/Win11 (14Z90R-G.AH75A5),https://www.thegioididong.com/laptop/lg-gram-2023-i7-14z90rgah75a5,"Laptop LG gram 2023 i7 1360P (14Z90R-G.AH75A5) mang hiệu năng xử lý vượt trội từ chip Intel Gen 13 mới nhất cùng thiết kế sang trọng, bắt mắt và mỏng nhẹ chắc chắn sẽ là một trợ thủ đắc lực hỗ trợ bạn hoàn thành mọi tác vụ công việc.",38.990.000₫ ,,,,
147,306797,Laptop LG gram Style 2023 i5 1340P/16GB/512GB/90Hz/Win11 (14Z90RS-G.AH54A5),https://www.thegioididong.com/laptop/lg-gram-style-2023-i5-14z90rsgah54a5,"Laptop LG gram Style 2023 i5 1340P (14Z90RS-G.AH54A5) với thiết kế cuốn hút, mỏng nhẹ nhưng lại sở hữu hiệu năng vượt trội cùng những tính năng tân tiến, chắc chắn là một sự lựa chọn hoàn hảo để giúp bạn giải quyết mọi tác vụ công việc.",38.990.000₫ ,,,,
148,309017,Laptop MacBook Air 15 inch M2 2023 8CPU/8GB/512GB/10GPU (MQKX3SA/A),https://www.thegioididong.com/laptop/apple-macbook-air-15-inch-m2-2023,"Sự gọn nhẹ trong thiết kế cùng tính linh hoạt trong hiệu năng luôn là những tiêu chí ấn định với dòng Macbook Air của nhà Apple. MacBook Air 15 inch M2 2023 512 GB đã quay trở lại với phiên bản hoàn toàn mới vào năm nay, mang đến không gian trải nghiệm rộng lớn cho người dùng.",37.990.000₫ ,,,,
149,309018,Laptop MacBook Air 15 inch M2 2023 8CPU/16GB/256GB/10GPU (Z18L),https://www.thegioididong.com/laptop/apple-macbook-air-m2-2023-16gb,"Sự kiện 2023 của nhà Apple với sự ra mắt cùng diện mạo mới của chiếc MacBook Air 15 inch M2 2023 10-core GPU, có không gian trải nghiệm nội dung rộng lớn với màn hình 15 inch. Với những người dùng yêu thích tính gọn nhẹ cũng như sở hữu hiệu năng mạnh của dòng Macbook Air thì chắc chắn không thể bỏ qua sản phẩm này.",37.990.000₫ ,,,,
150,308000,Laptop Asus Zenbook S 13 OLED UX5304VA i7 1355U/16GB/512GB/Túi/Win11 (NQ125W),https://www.thegioididong.com/laptop/asus-zenbook-s-13-oled-ux5304va-i7-nq125w,"Laptop Asus Zenbook S 13 OLED UX5304VA i7 1355U (NQ125W) có thiết kế siêu mỏng với cân nặng chỉ 1 kg, cùng những thông số cấu hình mạnh mẽ cho bạn trải nghiệm làm việc mượt mà và công nghệ OLED tân tiến sẽ mang đến cho bạn hình ảnh sống động và chân thực.",36.990.000₫ *,39.990.000₫,-7%,,
151,302520,Laptop Lenovo Yoga Duet 7 13ITL6 i7 1165G7/16GB/1TB/Touch/Pen/Win11 (82MA009PVN),https://www.thegioididong.com/laptop/lenovo-yoga-duet-7-13itl6-i7-82ma009pvn,"Laptop Lenovo Yoga Duet 7 13ITL6 i7 (82MA009PVN) độc đáo với thiết kế linh hoạt, cho phép bạn sử dụng máy như một chiếc laptop làm việc đầy năng suất hay một chiếc tablet giúp thỏa mãn mọi nhu cầu giải trí.",36.490.000₫ ,,,4.5,2.0
152,305666,Laptop Asus Gaming ROG Strix G16 G614JU i5 13450HX/8GB/512GB/6GB RTX4050/165Hz/Win11 (N3135W),https://www.thegioididong.com/laptop/asus-gaming-rog-strix-g16-g614ju-i5-n3135w,"Laptop Asus Gaming ROG Strix G16 G614JU i5 13450HX (N3135W) được trang bị bộ bộ vi xử lý Intel thế hệ 13 mới nhất, RAM DDR5 tân tiến và card đồ họa NVIDIA RTX 400 series mạnh mẽ, có thể vận hành hoàn hảo các tựa game nặng và ứng dụng đòi hỏi nhiều tài nguyên hệ thống.",36.190.000₫ *,39.990.000₫,-9%,,
153,310447,Laptop MSI Gaming Katana 15 B13VFK i7 13620H/16GB/1TB/8GB RTX4060/144Hz/Balo/Win11 (676VN),https://www.thegioididong.com/laptop/msi-katana-15-b13vfk-i7-676vn,"Laptop MSI Gaming Katana 15 B13VFK i7 13620H (676VN) đến từ nhà MSI đã có mặt tại Thế Giới Di Động. Với chip Intel Gen 13 dòng H mới nhất và card RTX 40 series mạnh mẽ, đây là một siêu phẩm laptop gaming sẽ thỏa mãn mọi nhu cầu của cộng đồng game thủ.",33.890.000₫ *,36.990.000₫,-8%,,
154,306792,Laptop LG gram 2023 i5 1340P/16GB/256GB/Win11 (14Z90R-G.AH53A5),https://www.thegioididong.com/laptop/lg-gram-2023-i5-14z90rgah53a5,"Laptop LG gram 2023 i5 1340P (14Z90R-G.AH53A5) được trang bị các tính năng vượt trội, sở hữu ngoại hình sang trọng, nịnh mắt. Chiếc laptop cao cấp này chắc chắn sẽ đem lại cho người dùng trải nghiệm tốt nhất khi sử dụng.",32.490.000₫ ,,,,
155,299061,Laptop Asus Gaming TUF Dash F15 FX517ZR i7 12650H/8GB/512GB/8GB RTX3070/144Hz/Win11 (HN086W),https://www.thegioididong.com/laptop/asus-tuf-gaming-fx517z-i7-hn086w,"Laptop Asus Gaming TUF Dash F15 FX517ZR i7 (HN086W) hứa hẹn sẽ mang đến cho game thủ trải nghiệm không thể tuyệt vời hơn nhờ sở hữu bộ vi xử lý Intel Core i7 thế hệ thứ 12 hiệu suất cao, card đồ hoạ rời NVIDIA mạnh mẽ và màn hình 144 Hz hoàn hảo để tỏa sáng trong mọi chiến trường ảo.",31.990.000₫ *,35.990.000₫,-11%,5,2.0
156,310452,Laptop MSI Prestige 13 Evo A13M i7 1360P/16GB/1TB/Balo/Win11 (081VN),https://www.thegioididong.com/laptop/msi-prestige-13-evo-a13m-i7-081vn,"Với sự hoàn thiện đẹp mắt, cấu trúc thiết kế gọn nhẹ, linh hoạt cùng hiệu năng mạnh mẽ đáp ứng đa tác vụ, laptop MSI Prestige 13 Evo A13M i7 1360P (081VN) chắc chắn sẽ là người trợ thủ đắc lực đem lại sự chuyên nghiệp và tính hiệu quả cao trong công việc cho người dùng.",31.490.000₫ *,33.990.000₫,-7%,,
157,293982,Laptop Asus TUF Gaming F15 FX507ZM i7 12700H/16GB/512GB/6GB RTX3060/144Hz/Win11 (HN123W),https://www.thegioididong.com/laptop/asus-tuf-gaming-fx507z-i7-hn123w,"Laptop Asus TUF Gaming F15 FX507Z i7 12700H (HN123W) được trang bị bộ vi xử lý Intel Core i7 H-series hiệu năng cao, card đồ họa chuyên dụng NVIDIA GeForce RTX 3060 và màn hình tần số quét 144 Hz giúp các cao thủ chiến game đầy tự tin, đắm chìm trong những đấu trường ảo đỉnh cao.",30.990.000₫ *,32.990.000₫,-6%,5,4.0
158,302228,Laptop Lenovo Yoga Slim 7 Pro 14IAH7 i7 12700H/16GB/512GB/Win11 (82UT006CVN),https://www.thegioididong.com/laptop/lenovo-yoga-slim-7-pro-14iah7-i7-82ut006cvn,"Sở hữu lối thiết kế thanh lịch, mỏng nhẹ đến không tưởng cùng sức mạnh hiệu năng vượt trội và màn hình OLED sắc nét, tất cả đã khiến cho laptop Lenovo Yoga Slim 7 Pro 14IAH7 i7 (82UT006CVN) trở thành ""hoa khôi"" trong phân khúc laptop học tập - văn phòng.",30.990.000₫ ,,,3.8,4.0
159,288373,Laptop Lenovo Yoga Slim 7 Carbon 13ITL5 i7 1165G7/16GB/1TB/Win11 (82EV00AWVN),https://www.thegioididong.com/laptop/lenovo-yoga-slim-7-carbon-13itl5-i7-82ev00awvn,"Laptop Lenovo Yoga Slim 7 Carbon 13ITL5 i7 1165G7 (82EV00AWVN) là phiên bản laptop mỏng nhẹ sở hữu phong cách thiết kế tối giản, hiện đại với khối lượng chỉ vỏn vẹn 0.966 kg đi cùng cấu hình ổn định, đáp ứng đầy đủ mọi nhu cầu học tập và văn phòng của người dùng.",29.740.000₫ *,34.990.000₫,-15%,4.5,10.0
160,309410,Laptop Asus Zenbook 14 OLED UX3402VA i7 1360P/16GB/512GB/Cáp/Túi/Win11 (KM068W),https://www.thegioididong.com/laptop/asus-zenbook-14-oled-ux3402va-i7-km068w,"Laptop Asus Zenbook 14 OLED UX3402VA i7 1360P (KM068W) là một chiếc laptop đáng cân nhắc với hiệu năng từ Core i7 mạnh mẽ và thiết kế sang trọng cùng đa dạng công nghệ màn hình hiện đại, sản phẩm thuộc phân khúc laptop cao cấp này chắc chắn mang lại sự thỏa mãn cho người dùng.",29.490.000₫ *,31.990.000₫,-7%,,
161,292394,Laptop Lenovo Yoga Duet 7 13ITL6 i5 1135G7/8GB/512GB/Touch/Pen/Win11 (82MA009NVN),https://www.thegioididong.com/laptop/lenovo-yoga-duet-7-13itl6-i5-82ma009nvn,"Laptop Lenovo Yoga Duet 7 13ITL6 i5 (82MA009NVN) thuộc dòng laptop cao cấp 2 trong 1, vừa có thể sử dụng như máy tính thông thường vừa là tablet mỏng nhẹ, kết hợp hiệu năng ổn định giúp bạn hoàn thành mọi công việc một cách nhanh chóng.",28.490.000₫ ,,,,
162,304540,Laptop MSI Summit E14 Flip Evo A12MT i7 1280P/16GB/512GB/Touch/Pen/Túi/Win11 (210VN),https://www.thegioididong.com/laptop/msi-summit-e14-flip-evo-a12mt-i7-210vn,"Laptop MSI Summit E14 Flip Evo A12MT i7 1280P (210VN) là sản phẩm mới nhất thuộc dòng laptop cao cấp vừa được MSI tung ra thị trường, máy được trang bị các tính năng vượt trội giúp người dùng có được trải nghiệm tốt nhất khi sử dụng.",27.990.000₫ *,30.990.000₫,-9%,,
163,306070,Laptop Asus Zenbook 14 Flip OLED UP3404VA i5 1340P/16GB/512GB/Touch/Pen/Cáp/Túi/Win11 (KN038W),https://www.thegioididong.com/laptop/asus-zenbook-14-flip-oled-up3404va-i5-kn038w,"Laptop Asus Zenbook 14 Flip OLED UP3404VA i5 1340P (KN038W) - một trong những sản phẩm mới nhất của Asus đã có mặt tại Thế Giới Di Động, được trang bị bộ vi xử lý Intel thế hệ 13 tân tiến và màn hình OLED 14 inch cảm ứng đa điểm với thiết kế 2 trong 1, cho phép bạn sử dụng máy như một chiếc laptop hoặc tablet.",27.990.000₫ *,29.990.000₫,-6%,4.5,4.0
164,283458,Laptop Acer Nitro 5 Tiger AN515 58 773Y i7 12700H/8GB/512GB/4GB RTX3050Ti/144Hz/Win11 (NH.QFKSV.001),https://www.thegioididong.com/laptop/acer-nitro-5-tiger-an515-58-773y-i7-nhqfksv001,"Đánh bật nhiều đối thủ trong cùng phân khúc laptop gaming với sự xuất hiện của con chip Intel Gen 12 đầy mạnh mẽ, laptop Acer Nitro 5 Tiger AN515 58 773Y i7 (NH.QFKSV.001) hứa hẹn sẽ là cánh tay phải đắc lực cho các game thủ oanh tạc trên mọi chiến trường.",27.490.000₫ *,31.990.000₫,-14%,4.9,24.0
165,309305,Laptop Dell Inspiron 14 7430 2-in-1 i7 1355U/16GB/512GB/Touch/Pen/OfficeHS/Win11 (i7U165W11SLU),https://www.thegioididong.com/laptop/dell-inspiron-14-7430-2-in-1-i7-i7u165w11slu,"Laptop Dell Inspiron 14 7430 2-in-1 i7 1355U (i7U165W11SLU) sẽ mang đến cho người dùng trải nghiệm sử dụng thú vị với hiệu năng mạnh mẽ từ con chip Intel Gen 13, tính năng cảm ứng đa điểm, mở gập 360 độ cùng thiết kế bắt mắt. Chiếc laptop cao cấp này chắc chắn sẽ thỏa mãn mọi nhu cầu của bạn.",27.290.000₫ ,29.490.000₫,-7%,,
166,288199,Laptop Lenovo Ideapad 5 Pro 14IAP7 i7 1260P/16GB/512GB/Win11(82SH002SVN),https://www.thegioididong.com/laptop/lenovo-ideapad-5-pro-14iap7-i7-82sh002svn,"Laptop Lenovo Ideapad 5 Pro 14IAP7 i7 (82SH002SVN) là một sự lựa chọn tuyệt vời cho những ai muốn sở hữu một chiếc laptop có cấu hình mạnh mẽ, màn hình hiển thị sắc nét và thiết kế mỏng nhẹ dễ dàng di chuyển và sử dụng trong suốt cả ngày.",26.690.000₫ *,27.990.000₫,,4,7.0
167,288305,Laptop Lenovo Yoga 7 14IAL7 i5 1240P/16GB/512GB/Touch/Pen/Win11 (82QE000RVN),https://www.thegioididong.com/laptop/lenovo-yoga-7-14ial7-i5-82qe000rvn,"Một chiếc laptop cao cấp phục vụ tốt cho công việc thường xuyên phải di chuyển đòi hỏi thiết kế mỏng nhẹ cùng hiệu năng mạnh mẽ, laptop Lenovo Yoga 7 14IAL7 i5 1240P (82QE000RVN) là sự lựa chọn hoàn hảo dành cho người dùng cần đáp ứng công việc mọi lúc mọi nơi.",26.340.000₫ *,30.990.000₫,-15%,4,11.0
168,311117,Laptop Asus Vivobook 14X OLED K3405VC i5 13500H/16GB/512GB/4GB RTX3050/Win11 (KM006W),https://www.thegioididong.com/laptop/asus-vivobook-14x-oled-k3405vc-i5-km006w,"Mỏng nhẹ, di động nhưng không đánh đổi về hiệu năng luôn là những ưu điểm mà người dùng mong đợi ở những chiếc Vivobook từ nhà Asus. Laptop Asus Vivobook 14X OLED K3405VC i5 13500H (KM006W) cũng không ngoại lệ với sức mạnh vượt trội từ con chip Intel Gen 13 thế hệ mới, card RTX 30 series cùng sự nhẹ nhàng về khối lượng, chắc chắn sẽ nâng tầm hơn nữa mọi trải nghiệm của bạn.",25.990.000₫ ,29.490.000₫,-11%,,
169,275229,Laptop Asus TUF Gaming F15 FX507ZC i7 12700H/8GB/512GB/4GB RTX3050/144Hz/Win11 (HN124W),https://www.thegioididong.com/laptop/asus-tuf-gaming-fx507zc-i7-hn124w,"Laptop Asus TUF Gaming F15 FX507ZC i7 (HN124W) cực chất cùng hiệu năng mạnh mẽ từ CPU Intel thế hệ 12, thiết kế thời thượng sẵn sàng thách thức chinh phục ở mọi đấu trường ảo.",25.490.000₫ *,32.490.000₫,-21%,4.2,25.0
170,304260,Laptop Asus Zenbook 14 OLED UX3402VA i5 1340P/16GB/512GB/Cáp/Túi/Win11 (KM085W),https://www.thegioididong.com/laptop/asus-zenbook-14-oled-ux3402va-i5-km085w,"Thêm một mẫu laptop cao cấp nữa được trang bị bộ vi xử lý Intel thế hệ 13 được lên kệ tại Thế Giới Di Động, đó là laptop Asus Zenbook 14 OLED UX3402VA i5 (KM085W) với thiết kế trẻ trung cùng những thông số ấn tượng.",25.490.000₫ *,27.990.000₫,-8%,4.5,6.0
171,306603,Laptop Dell Inspiron 5430 i5 1340P/16GB/512GB/2GB MX550/OfficeHS/Win11 (i5P165W11SLD2),https://www.thegioididong.com/laptop/dell-inspiron-5430-i5-i5p165w11sld2,"Laptop Dell Inspiron 5430 i5 1340P (i5P165W11SLD2) được trang bị bộ vi xử lý thế hệ thứ 13 mới nhất của Intel cùng card đồ họa rời MX, mang hiệu măng xử lý mạnh mẽ cùng thiết kế thanh lịch, là chiếc laptop đồ hoạ - kỹ thuật sẵn sàng đáp ứng mọi nhu cầu sử dụng của bạn.",25.490.000₫ *,27.490.000₫,-7%,2,1.0
172,285771,Laptop Asus Zenbook 14 OLED UX3402ZA i7 1260P/16GB/512GB/Cáp/Win11 (KM221W),https://www.thegioididong.com/laptop/asus-zenbook-14-oled-ux3402za-i7-km221w,"Laptop Asus Zenbook 14 OLED UX3402ZA i7 (KM221W) sở hữu ngoại hình thanh lịch, màn hình OLED 2.8K tỷ lệ 16:10 và bộ vi xử lý Intel Core i7 thế hệ thứ 12 mạnh mẽ, xứng danh một chiếc laptop học tập - văn phòng cùng mình chinh chiến trong suốt quãng đường đại học.",25.290.000₫ *,31.990.000₫,-20%,4.1,17.0
173,310451,Laptop MSI Prestige 14 Evo B13M i5 13500H/16GB/512GB/Balo/Win11 (401VN),https://www.thegioididong.com/laptop/msi-prestige-14-evo-b13m-i5-401vn,"Laptop MSI Prestige 14 Evo B13M i5 13500H (401VN) vừa sở hữu lối thiết kế sang trọng, linh hoạt, vừa mang trong mình hiệu năng mạnh mẽ của con chip Intel Gen 13, bộ nhớ RAM 16 GB cùng nhiều tính năng hiện đại đi kèm. Đây chắc chắn là một trong những mẫu laptop cao cấp - sang trọng đáng mua trên thị trường hiện nay.",24.690.000₫ *,26.990.000₫,-8%,,
174,284189,Laptop Lenovo Yoga Slim 7 Carbon 13ITL5 i5 1135G7/16GB/512GB/Win11 (82EV00AVVN),https://www.thegioididong.com/laptop/lenovo-yoga-slim-7-carbon-13itl5-i5-82nh00avvn,"Thời thượng, sang trọng với sắc trắng tinh khôi cùng những thông số kỹ thuật đáng kinh ngạc và khối lượng máy chưa đầy 1 kg, laptop Lenovo Yoga Slim 7 Carbon 13ITL5 i5 (82EV00AVVN) hoàn toàn xứng đáng trở thành trợ thủ đắc lực đồng hành cùng bạn mỗi ngày.  ",24.640.000₫ *,28.990.000₫,-15%,4.5,6.0
175,302487,Laptop HP Gaming VICTUS 16 e1102AX R7 6800H/16GB/512GB/4GB RTX3050Ti/144Hz/Win11 (7C139PA),https://www.thegioididong.com/laptop/hp-victus-16-e1102ax-r7-7c139pa,"Sở hữu bộ vi xử lý AMD Ryzen 7 hiệu năng cao, card đồ họa NVIDIA GeForce RTX mạnh mẽ và màn hình 144 Hz siêu mượt mà, tất cả đã khiến cho laptop HP VICTUS 16 e1102AX R7 (7C139PA) trở thành một lựa chọn không thể tốt hơn để phục vụ cho công việc và giải trí.",23.990.000₫ *,30.990.000₫,-22%,4.9,7.0
176,303079,Laptop HP Pavilion X360 14 ek0132TU i7 1255U/16GB/512GB/Touch/Pen/Win11 (7C0W4PA),https://www.thegioididong.com/laptop/hp-pavilion-x360-14-ek0132tu-i7-7c0w4pa,"Laptop HP Pavilion X360 14 ek0132TU i7 (7C0W4PA) với kiểu dáng xoay gập 360 độ linh hoạt trong mọi tình huống sử dụng, cấu hình mạnh mẽ có thể cân hoàn hảo các tác vụ cơ bản thường ngày, một chiếc laptop học tập - văn phòng mà bạn không nên lướt qua.",23.990.000₫ *,26.990.000₫,-11%,4.2,12.0
177,306195,Laptop Asus Vivobook S 14 Flip TP3402VA i9 13900H/16GB/512GB/Touch/Win11 (LZ118W),https://www.thegioididong.com/laptop/asus-vivobook-s-14-flip-tp3402va-i9-lz118w,"Với thiết kế nhỏ gọn, cấu hình mạnh mẽ, màn hình cảm ứng và bản lề xoay 360 độ, laptop Asus Vivobook S 14 Flip TP3402VA i9 13900H (LZ118W) phù hợp với những người dùng cần một thiết bị gọn nhẹ, đa năng và tiện dụng như các bạn sinh viên, nhân viên văn phòng hay thậm chí là những doanh nhân kỹ tính.",23.990.000₫ *,26.490.000₫,-9%,,
178,292595,Laptop HP Envy X360 13 bf0095TU i5 1230U/16GB/512GB/Touch/Pen/Win11 (76B15PA),https://www.thegioididong.com/laptop/hp-envy-x360-13-bf0095tu-i5-76b15pa,"Nếu bạn đang tìm kiếm một chiếc laptop học tập - văn phòng có thể đáp ứng tất tần tật mọi nhu cầu sử dụng hằng ngày từ học tập, làm việc văn phòng đến thiết kế đồ họa, còn chần chừ gì nữa mà không tham khảo ngay laptop HP Envy X360 13 bf0095TU i5 (76B15PA) với thiết kế 2 trong 1 tiện lợi.",23.590.000₫ *,29.590.000₫,-20%,4.4,13.0
179,309735,Laptop HP Envy X360 13 bf0112TU i5 1230U/16GB/512GB/Touch/Pen/Win11 (7C0N9PA),https://www.thegioididong.com/laptop/hp-envy-x360-13-bf0112tu-i5-7c0n9pa,"Laptop HP Envy X360 13 bf0112TU i5 1230U (7C0N9PA) là một trong những chiếc laptop cao cấp được yêu thích nhất hiện nay với màn hình cảm ứng mượt mà, tính di động cao cùng hiệu năng mạnh mẽ mang lại những giây phút sáng tạo và giải trí tuyệt vời cho bạn.",23.590.000₫ *,29.590.000₫,-20%,4,3.0
180,306198,Laptop Asus Vivobook 14X OLED S3405VA i9 13900H/16GB/512GB/Win11 (KM071W),https://www.thegioididong.com/laptop/asus-vivobook-14x-oled-s3405va-i9-km071w,"Với những tính năng và cấu hình vượt trội, laptop ASUS Vivobook 14X OLED S3405VA i9 13900H (KM071W) phù hợp với người dùng làm công việc đòi hỏi khá cao về đồ họa như designer hay editor, hoặc những người yêu thích công nghệ và muốn sở hữu một chiếc laptop học tập - văn phòng hiệu năng cao, di động và bảo mật.",23.490.000₫ *,26.990.000₫,-12%,5,1.0
181,304541,Laptop MSI Summit E14 Evo A12M i7 1280P/16GB/512GB/Túi/Chuột/Win11 (211VN),https://www.thegioididong.com/laptop/msi-summit-e14-evo-a12m-i7-211vn,"Laptop MSI Summit E14 Evo A12M i7 1280P (211VN) mới nhất đến từ MSI đã có mặt tại Thế Giới Di Động, không chỉ có ngoại hình thời thượng đúng chuẩn một chiếc laptop cao cấp mà còn được trang bị các tính năng ấn tượng đáp ứng tốt nhu cầu của người dùng trong cả công việc và giải trí.",23.290.000₫ *,25.990.000₫,-10%,,
182,272282,Laptop Acer Nitro 5 Tiger AN515 58 52SP i5 12500H/8GB/512GB/4GB RTX3050/144Hz/Win11 (NH.QFHSV.001),https://www.thegioididong.com/laptop/acer-nitro-5-tiger-an515-58-52sp-i5-nhqfhsv001,"Một bước tiến cấu hình vượt bật được Acer ưu ái trên chiếc laptop Acer Nitro 5 Tiger AN515 58 52SP i5 (NH.QFHSV.001) khi trang bị bộ vi xử lý Intel Gen 12 đầy mạnh mẽ cùng phong cách thiết kế đậm chất “mãnh hổ”, khơi nguồn sức mạnh tiềm ẩn bên trong mỗi game thủ trên mọi chiến trường ảo. ",22.990.000₫ *,27.990.000₫,-17%,4.6,15.0
183,285248,Laptop Dell Vostro 5620 i5 1240P/16GB/512GB/OfficeHS/Win11 (70282719),https://www.thegioididong.com/laptop/dell-vostro-5620-i5-70282719,"Sắc xám huyền bí, thời thượng cùng sức mạnh bộc phá đến từ con chip Intel Gen 12 mạnh mẽ đã làm cho chiếc laptop Dell Vostro 5620 i5 (70282719) trở thành một trong những đối thủ xứng tầm ở phân khúc laptop học tập - văn phòng. ",22.990.000₫ *,24.990.000₫,-8%,4.2,10.0
184,292690,Laptop Asus Vivobook Pro 15 OLED K6502Z i5 12450H/16GB/512GB/4GB RTX3050/120Hz/Win11 (MA025W),https://www.thegioididong.com/laptop/asus-vivobook-pro-15-k6502z-i5-ma025w,"Một tân binh thuộc phân khúc laptop cao cấp - sang trọng được nhà Asus cho ra mắt để phục vụ tối đa mọi tác vụ từ cơ bản đến nâng cao cho dân văn phòng hay doanh nhân khi sở hữu những thông số mạnh mẽ từ cấu hình, màn hình,... chính là chiếc laptop Asus Vivobook Pro 15 K6502Z i5 12450H (MA025W). ",22.990.000₫ *,30.990.000₫,-25%,4.7,12.0
185,302209,Laptop HP Pavilion 15 eg2088TU i7 1260P/16GB/512GB/Win11 (7C0R0PA),https://www.thegioididong.com/laptop/hp-pavilion-15-eg2088tu-i7-7c0r0pa,"Laptop HP Pavilion 15 eg2088TU i7 (7C0R0PA) sẽ là lựa chọn tốt cho người dùng muốn tìm một chiếc laptop học tập - văn phòng đa năng, có thể đáp ứng hoàn hảo cho các tác vụ công việc và giải trí hằng ngày.",21.990.000₫ *,25.290.000₫,-13%,4.8,12.0
186,310607,Laptop MSI Gaming GF66 12UCK i7 12650H/8GB/512GB/4GB RTX3050/144Hz/Balo/Win11 (804VN),https://www.thegioididong.com/laptop/msi-gaming-gf66-12uck-i7-804vn,"Laptop MSI Gaming GF66 12UCK i7 12650H (804VN) chắc chắn sẽ là sự lựa chọn tuyệt vời cho anh em game thủ với thông số cấu hình mạnh mẽ đến từ chip Intel dòng H và card rời RTX 30 series, là mẫu laptop gaming giúp bạn chinh phục các tựa game đỉnh cao.",21.790.000₫ *,27.490.000₫,-20%,,
187,306605,Laptop Dell Vostro 5630 i5 1340P/8GB/512GB/OfficeHS/Win11 (i5P085W11GRU),https://www.thegioididong.com/laptop/dell-vostro-5630-i5-i5p085w11gru,"Laptop Dell Vostro 5630 i5 1340P (i5P085W11GRU) sở hữu những thông số kỹ thuật ấn tượng từ cấu hình mạnh mẽ, màn hình sắc nét cho đến ngoại hình tinh tế, sang trọng. Chiếc laptop học tập - văn phòng này sẽ là sự lựa chọn tuyệt vời để đáp ứng đầy đủ các nhu cầu của bạn.",21.490.000₫ *,23.190.000₫,-7%,,
188,285967,Laptop HP Pavilion 15 eg2034TX i7 1255U/8GB/512GB/2GB MX550/Win11 (6K780PA),https://www.thegioididong.com/laptop/hp-pavilion-15-eg2034tx-i7-6k780pa,Laptop HP Pavilion 15 eg2034TX i7 (6K780PA) hứa hẹn sẽ là một đối thủ đáng quan ngại trong phân khúc laptop học tập - văn phòng khi sở hữu cấu hình mạnh mẽ đến từ chip Intel Gen 12 cùng ngoại hình đơn giản nhưng không kém phần hiện đại.,21.390.000₫ *,24.590.000₫,-13%,3.7,9.0
189,305011,Laptop Asus TUF Gaming F15 FX507ZC4 i5 12500H/16GB/512GB/4GB RTX3050/144Hz/Win11 (HN095W),https://www.thegioididong.com/laptop/asus-tuf-gaming-f15-fx507zc4-i5-hn095w,"Laptop Asus TUF Gaming F15 FX507ZC4 i5 12500H (HN095W) sở hữu bộ vi xử lý mạnh mẽ, card đồ họa chuyên dụng và màn hình tần số quét cao, một sự lựa chọn không thể tuyệt vời hơn dành cho người dùng cần một chiếc laptop gaming hiệu suất cao.",20.990.000₫ *,27.990.000₫,-25%,5,4.0
190,306197,Laptop Asus Vivobook 14X OLED S3405VA i5 13500H/16GB/512GB/Win11 (KM072W),https://www.thegioididong.com/laptop/asus-vivobook-14x-oled-s3405va-i5-km072w,"Laptop Asus Vivobook 14X OLED S3405VA i5 13500H (KM072W) là một sản phẩm tốt với cấu hình mạnh mẽ và màn hình OLED sắc nét, được thiết kế đặc biệt cho sinh viên và nhân viên văn phòng, cũng như cho những người dùng đang tìm kiếm một chiếc laptop mỏng nhẹ và tiện lợi.",20.990.000₫ *,22.990.000₫,-8%,4.2,6.0
